### ISSUE TITLE
Implementing bulkwalk planned?

### ISSUE THREAD

**Issue by LaMi-** [fgimian/easysnmp#20]
I am missing a library native implementation of bulkwalks. The origin NetSNMP python bindings don't implement the bulkwalk either. I wonder if you plan to directly implement a bulkwalk API call?

**Comment by fgimian** [comment]
There are a few other things missing too like snmptrap.  Right now, Easy SNMP is completely based on the original Net-SNMP bindings, we provide exactly what was provided originally.

I would love to see the remaining functions implemented but honestly, I don't believe this is something I would do alone since the current functionality gives us what we need for our internal projects.

However, I welcome pull requests for the additional functions :smile: 

Cheers
Fotis

**Comment by nnathan** [comment]
I don't mind implementing this feature, but I feel the project is going to be in maintenance mode soon.

Just for as a reference to my self: [snmpbulkwalk source code](https://github.com/haad/net-snmp/blob/master/apps/snmpbulkwalk.c).

@fgimian Feel free to assign this to me.

@LaMi- are you currently using bulkwalk and would you be able to provide some testing if I push this feature forward?

**Comment by fgimian** [comment]
lol, sorry about al that re-assigning ... I was having trouble working it :smile: 

Anyway, welcome aboard officially @nnathan, I've assigned this one to you mate

Cheers
Fotis

**Comment by LaMi-** [comment]
Good to hear. I had a short look to your changes and the new API. I looks pretty promising. Currently I use the origin NetSNMP code, but it seems to be worth it to switch to Easy SNMP.

@nnathan yes. Just let me know when you got anything to test.

**Comment by nnathan** [comment]
Hi @LaMi- I was looking at how bulkwalk is implemented in [the perl bindings](https://github.com/haad/net-snmp/blob/master/perl/SNMP/SNMP.xs). It looks like bulkwalk is a lot more complicated than expected. I think I will first complete issue #21 to implement `snmp_walk` using iterators, since that pattern seemingly lends itself to `snmp_bulk_walk`.

But I'll need to think of a nice way to integrate this into the C code which means studying the bindings for Perl. Because the last thing I want to do is hack it all in :).

**Comment by LaMi-** [comment]
@nnathan: Another source for information might be the source of the snmpbulkwalk command. One thing I found one day was that it is doing a single get after trying the getbulk. I can not remember exactly in which case snmpbulkwalk is doing this, but there is definetly something I was not expecting in the first moment.

**Comment by nnathan** [comment]
Here is a transcript of a tcpdump running `snmpbulkwalk -v2c -c public -On localhost:11161 .`:

```bash
$ sudo tcpdump -s 1024 -ni lo -Tsnmp port 11161
05:07:32.698386 IP 127.0.0.1.46878 > 127.0.0.1.11161:  GetBulk(21)  N=0 M=10 .0.1
05:07:32.698630 IP 127.0.0.1.11161 > 127.0.0.1.46878:  GetResponse(356)  .1.3.6.1.2.1.1.1.0="Linux myhostname 3.13.0-54-generic #91-Ubuntu SMP Tue May 26 19:15:08 UTC 2015 x86_64" .1.3.6.1.2.1.1.2.0=.1.3.6.1.4.1.8072.3.2.10 .1.3.6.1.2.1.1.3.0=150294365 .1.3.6.1.2.1.1.4.0="G. S. Marzot <gmarzot@marzot.net>" .1.3.6.1.2.1.1.5.0="myhostname" .1.3.6.1.2.1.1.6.0="my original location" .1.3.6.1.2.1.1.8.0=0 .1.3.6.1.2.1.1.9.1.2.1=.1.3.6.1.6.3.11.3.1.1 .1.3.6.1.2.1.1.9.1.2.2=.1.3.6.1.6.3.15.2.1.1 .1.3.6.1.2.1.1.9.1.2.3=.1.3.6.1.6.3.10.3.1.1
05:07:32.698804 IP 127.0.0.1.46878 > 127.0.0.1.11161:  GetBulk(30)  N=0 M=10 .1.3.6.1.2.1.1.9.1.2.3
05:07:32.698926 IP 127.0.0.1.11161 > 127.0.0.1.46878:  GetResponse(386)  .1.3.6.1.2.1.1.9.1.2.4=.1.3.6.1.6.3.1 .1.3.6.1.2.1.1.9.1.2.5=.1.3.6.1.2.1.49 .1.3.6.1.2.1.1.9.1.2.6=.1.3.6.1.2.1.4 .1.3.6.1.2.1.1.9.1.2.7=.1.3.6.1.2.1.50 .1.3.6.1.2.1.1.9.1.2.8=.1.3.6.1.6.3.16.2.2.1 .1.3.6.1.2.1.1.9.1.2.9=.1.3.6.1.6.3.13.3.1.3 .1.3.6.1.2.1.1.9.1.2.10=.1.3.6.1.2.1.92 .1.3.6.1.2.1.1.9.1.3.1="The MIB for Message Processing and Dispatching." .1.3.6.1.2.1.1.9.1.3.2="The management information definitions for the SNMP User-based Security Model." .1.3.6.1.2.1.1.9.1.3.3="The SNMP Management Architecture MIB."
05:07:32.699044 IP 127.0.0.1.46878 > 127.0.0.1.11161:  GetBulk(30)  N=0 M=10 .1.3.6.1.2.1.1.9.1.3.3
05:07:32.699163 IP 127.0.0.1.11161 > 127.0.0.1.46878:  GetResponse(512)  .1.3.6.1.2.1.1.9.1.3.4="The MIB module for SNMPv2 entities" .1.3.6.1.2.1.1.9.1.3.5="The MIB module for managing TCP implementations" .1.3.6.1.2.1.1.9.1.3.6="The MIB module for managing IP and ICMP implementations" .1.3.6.1.2.1.1.9.1.3.7="The MIB module for managing UDP implementations" .1.3.6.1.2.1.1.9.1.3.8="View-based Access Control Model for SNMP." .1.3.6.1.2.1.1.9.1.3.9="The MIB modules for managing SNMP Notification, plus filtering." .1.3.6.1.2.1.1.9.1.3.10="The MIB module for logging SNMP Notifications." .1.3.6.1.2.1.1.9.1.4.1=0 .1.3.6.1.2.1.1.9.1.4.2=0 .1.3.6.1.2.1.1.9.1.4.3=0
05:07:32.699257 IP 127.0.0.1.46878 > 127.0.0.1.11161:  GetBulk(30)  N=0 M=10 .1.3.6.1.2.1.1.9.1.4.3
05:07:32.699912 IP 127.0.0.1.11161 > 127.0.0.1.46878:  GetResponse(183)  .1.3.6.1.2.1.1.9.1.4.4=0 .1.3.6.1.2.1.1.9.1.4.5=0 .1.3.6.1.2.1.1.9.1.4.6=0 .1.3.6.1.2.1.1.9.1.4.7=0 .1.3.6.1.2.1.1.9.1.4.8=0 .1.3.6.1.2.1.1.9.1.4.9=0 .1.3.6.1.2.1.1.9.1.4.10=0 .1.3.6.1.2.1.2.1.0=3 .1.3.6.1.2.1.2.2.1.1.1=1 .1.3.6.1.2.1.2.2.1.1.2=2
05:07:32.700008 IP 127.0.0.1.46878 > 127.0.0.1.11161:  GetBulk(30)  N=0 M=10 .1.3.6.1.2.1.2.2.1.1.2
05:07:32.700518 IP 127.0.0.1.11161 > 127.0.0.1.46878:  GetResponse(199)  .1.3.6.1.2.1.2.2.1.1.3=3 .1.3.6.1.2.1.2.2.1.2.1="lo" .1.3.6.1.2.1.2.2.1.2.2="eth0" .1.3.6.1.2.1.2.2.1.2.3="docker0" .1.3.6.1.2.1.2.2.1.3.1=24 .1.3.6.1.2.1.2.2.1.3.2=6 .1.3.6.1.2.1.2.2.1.3.3=6 .1.3.6.1.2.1.2.2.1.4.1=65536 .1.3.6.1.2.1.2.2.1.4.2=1500 .1.3.6.1.2.1.2.2.1.4.3=1500
05:07:32.700612 IP 127.0.0.1.46878 > 127.0.0.1.11161:  GetBulk(30)  N=0 M=10 .1.3.6.1.2.1.2.2.1.4.3
05:07:32.701121 IP 127.0.0.1.11161 > 127.0.0.1.46878:  GetResponse(197)  .1.3.6.1.2.1.2.2.1.5.1=10000000 .1.3.6.1.2.1.2.2.1.5.2=0 .1.3.6.1.2.1.2.2.1.5.3=0 .1.3.6.1.2.1.2.2.1.6.1="" .1.3.6.1.2.1.2.2.1.6.2=aa_00_00_96_f6_be .1.3.6.1.2.1.2.2.1.6.3=56_84_7a_fe_97_99 .1.3.6.1.2.1.2.2.1.7.1=1 .1.3.6.1.2.1.2.2.1.7.2=1 .1.3.6.1.2.1.2.2.1.7.3=1 .1.3.6.1.2.1.2.2.1.8.1=1
05:07:32.701215 IP 127.0.0.1.46878 > 127.0.0.1.11161:  GetBulk(30)  N=0 M=10 .1.3.6.1.2.1.2.2.1.8.1
05:07:32.701736 IP 127.0.0.1.11161 > 127.0.0.1.46878:  GetResponse(198)  .1.3.6.1.2.1.2.2.1.8.2=1 .1.3.6.1.2.1.2.2.1.8.3=2 .1.3.6.1.2.1.2.2.1.9.1=0 .1.3.6.1.2.1.2.2.1.9.2=0 .1.3.6.1.2.1.2.2.1.9.3=0 .1.3.6.1.2.1.2.2.1.10.1=3927423455 .1.3.6.1.2.1.2.2.1.10.2=362400176 .1.3.6.1.2.1.2.2.1.10.3=0 .1.3.6.1.2.1.2.2.1.11.1=24315648 .1.3.6.1.2.1.2.2.1.11.2=94772741
05:07:32.701832 IP 127.0.0.1.46878 > 127.0.0.1.11161:  GetBulk(30)  N=0 M=10 .1.3.6.1.2.1.2.2.1.11.2
[...]
```

One thing is for certain, each GetBulk request is for a single OID (the last OID from the previous packet). I am hoping the protocol is as simple as that, but the Perl module makes it seem far more complicated. The `snmpwalk` is similar, except it only does one OID at a time using `GetNextRequest`.

I do think both would benefit greatly from using iterators since the state between each successive call is the next OID.

**Comment by kamakazikamikaze** [comment]
I'm interested in this implementation as well since it's a feature that some other packages lack. I'll be glad to do anything testing you need to verify that the implementation works since we're deploying `netsnmp` and `fastsnmpy` for a large-scale network.

**Comment by nnathan** [comment]
Thanks for the interest.

At the moment I'm fixing https://github.com/fgimian/easysnmp/issues/30 which happens to involve a heavy refactor of the C extension([see commit log]( https://github.com/nnathan/easysnmp/commits/max_value_size_fix)). I anticipate completing this at the end of the month and proceeding to work on this issue next.

**Comment by LEALCorentin** [comment]
Hi everybody,

Do you have any news about implementing the bulk walk functionality ?
It could be very useful for me.

Thanks for your work.

**Comment by kamakazikamikaze** [comment]
@LEALCorentin As you've probably read, nnathan will address that once #30 has been fixed. I've also raised attention to an issue where `walk` causes memory leaks which may or may not be addressed before they begin work on `bulk_walk`.

**Comment by kamakazikamikaze** [comment]
If anyone is still listening to this thread, I've implemented `bulk_walk` and fixed some leaks with `walk`. See PR #48 (still open at this time). You can manually install my version and use it until it becomes part of the main package

**Comment by abhangprashant** [comment]
Anyone please let me know if feature ` traps ` added in easysnmp?

**Comment by davidfa94** [comment]
> Anyone please let me know if feature `traps` added in easysnmp?

I'd really like to know too...

**Comment by kamakazikamikaze** [comment]
@abhangprashant and @davidfa94, `traps` currently are not implemented. I can add that to the backlog but it will be some time before I can tackle it.
